{
  "slug": "ordinary-gods",
  "title": "Ordinary Gods",
  "series": "The Divine Ascension",
  "seriesOrder": 1,
  "author": "Nerdy Fiction",
  "tagline": "The universe does not announce itself.",
  "description": "On the last night of 2026, at exactly 10:00 PM Eastern, something changed at the level where reality itself is written. Eight billion people felt nothing. A small handful hesitated. This is the story of how five of them found each other — and discovered they were not alone.",
  "publishedDate": "2026-06-13",
  "cover": {
    "gradientFrom": "#0a0805",
    "gradientTo": "#3d321e",
    "accent": "#ff3b1a",
    "glyph": "OG"
  },
  "characters": [
    {
      "id": "robert",
      "name": "Robert Calloway",
      "tagline": "A struggling actor who learned, in a waiting room, that he could move things without touching them.",
      "silhouetteColor": "#b09f7d"
    },
    {
      "id": "alex",
      "name": "Alex Whitfield",
      "tagline": "A mechanic who can take strength from one person and give it to another.",
      "silhouetteColor": "#5b9bd5"
    },
    {
      "id": "kassidy",
      "name": "Dr. Kassidy Chen",
      "tagline": "A research scientist who noticed an anomaly the moment it arrived, and refused to look away.",
      "silhouetteColor": "#7a5b9b"
    },
    {
      "id": "sam",
      "name": "Sam Patel",
      "tagline": "A jeweler whose hands learned, overnight, to read the shape of metal itself.",
      "silhouetteColor": "#9bb05b"
    },
    {
      "id": "farrukh",
      "name": "Farrukh",
      "tagline": "A rideshare driver from Ohio who can summon, and befriend, one ant a day.",
      "silhouetteColor": "#d68a3a"
    }
  ],
  "keywords": [
    "Ordinary Gods",
    "The Divine Ascension",
    "The Chosen Ones",
    "visual novel",
    "fantasy",
    "supernatural fiction",
    "web novel"
  ],
  "chapterCount": 12
}
